{
  "name": "hkbTransformVectorModifierInternalState",
  "version": 0,
  "signature": "0x5ca91c99",
  "size_x86": 32,
  "size_x86_64": 32,
  "parent": "hkReferencedObject",
  "vtable": true,
  "members": [
    {
      "name": "vectorOut",
      "offset_x86": 16,
      "offset_x86_64": 16,
      "ctype": "hkVector4",
      "vtype": "TYPE_VECTOR4",
      "vsubtype": "TYPE_VOID",
      "arrsize": 0,
      "flags": "FLAGS_NONE",
      "default": 0
    }
  ]
}