{
  "name": "hkpVehicleFrictionStatus",
  "version": 0,
  "signature": "0x1c076a84",
  "size_x86": 72,
  "size_x86_64": 72,
  "vtable": false,
  "members": [
    {
      "name": "axis",
      "offset_x86": 0,
      "offset_x86_64": 0,
      "class_ref": "hkpVehicleFrictionStatusAxisStatus",
      "ctype": "struct hkpVehicleFrictionStatusAxisStatus[2]",
      "vtype": "TYPE_STRUCT",
      "vsubtype": "TYPE_VOID",
      "arrsize": 2,
      "flags": "FLAGS_NONE",
      "default": 0
    }
  ]
}