{
  "name": "hkpPoweredChainDataConstraintInfo",
  "version": 0,
  "signature": "0xf88aee25",
  "size_x86": 80,
  "size_x86_64": 96,
  "parent_has_string": false,
  "vtable": false,
  "has_string": false,
  "members": [
    {
      "name": "pivotInA",
      "has_string": false,
      "ctype": "hkVector4",
      "vtype": "TYPE_VECTOR4",
      "vsubtype": "TYPE_VOID",
      "offset_x86": 0,
      "offset_x86_64": 0,
      "type_size_x86": 16,
      "type_size_x86_64": 16,
      "arrsize": 0,
      "flags": "FLAGS_NONE",
      "default": 0
    },
    {
      "name": "pivotInB",
      "has_string": false,
      "ctype": "hkVector4",
      "vtype": "TYPE_VECTOR4",
      "vsubtype": "TYPE_VOID",
      "offset_x86": 16,
      "offset_x86_64": 16,
      "type_size_x86": 16,
      "type_size_x86_64": 16,
      "arrsize": 0,
      "flags": "FLAGS_NONE",
      "default": 0
    },
    {
      "name": "aTc",
      "has_string": false,
      "ctype": "hkQuaternion",
      "vtype": "TYPE_QUATERNION",
      "vsubtype": "TYPE_VOID",
      "offset_x86": 32,
      "offset_x86_64": 32,
      "type_size_x86": 16,
      "type_size_x86_64": 16,
      "arrsize": 0,
      "flags": "FLAGS_NONE",
      "default": 0
    },
    {
      "name": "bTc",
      "has_string": false,
      "ctype": "hkQuaternion",
      "vtype": "TYPE_QUATERNION",
      "vsubtype": "TYPE_VOID",
      "offset_x86": 48,
      "offset_x86_64": 48,
      "type_size_x86": 16,
      "type_size_x86_64": 16,
      "arrsize": 0,
      "flags": "FLAGS_NONE",
      "default": 0
    },
    {
      "name": "motors",
      "class_ref": "hkpConstraintMotor",
      "has_string": false,
      "ctype": "struct hkpConstraintMotor*",
      "vtype": "TYPE_POINTER",
      "vsubtype": "TYPE_STRUCT",
      "offset_x86": 64,
      "offset_x86_64": 64,
      "type_size_x86": 12,
      "type_size_x86_64": 24,
      "arrsize": 3,
      "flags": "FLAGS_NONE",
      "default": 0
    },
    {
      "name": "switchBodies",
      "has_string": false,
      "ctype": "hkBool",
      "vtype": "TYPE_BOOL",
      "vsubtype": "TYPE_VOID",
      "offset_x86": 76,
      "offset_x86_64": 88,
      "type_size_x86": 1,
      "type_size_x86_64": 1,
      "arrsize": 0,
      "flags": "FLAGS_NONE",
      "default": 0
    }
  ]
}