{
  "name": "hkpPrismaticConstraintData",
  "version": 0,
  "signature": "0x3996c387",
  "size_x86": 208,
  "size_x86_64": 240,
  "parent": "hkpConstraintData",
  "vtable": true,
  "members": [
    {
      "name": "atoms",
      "offset_x86": 16,
      "offset_x86_64": 32,
      "class_ref": "hkpPrismaticConstraintDataAtoms",
      "ctype": "struct hkpPrismaticConstraintDataAtoms",
      "vtype": "TYPE_STRUCT",
      "vsubtype": "TYPE_VOID",
      "arrsize": 0,
      "flags": "FLAGS_NONE|ALIGN_16",
      "default": 0
    }
  ]
}