{
  "name": "hkpVehicleDefaultAerodynamics",
  "version": 0,
  "signature": "0x42fc5bbd",
  "size_x86": 48,
  "size_x86_64": 48,
  "parent": "hkpVehicleAerodynamics",
  "vtable": true,
  "members": [
    {
      "name": "airDensity",
      "offset_x86": 8,
      "offset_x86_64": 16,
      "ctype": "hkReal",
      "vtype": "TYPE_REAL",
      "vsubtype": "TYPE_VOID",
      "arrsize": 0,
      "flags": "FLAGS_NONE",
      "default": 0
    },
    {
      "name": "frontalArea",
      "offset_x86": 12,
      "offset_x86_64": 20,
      "ctype": "hkReal",
      "vtype": "TYPE_REAL",
      "vsubtype": "TYPE_VOID",
      "arrsize": 0,
      "flags": "FLAGS_NONE",
      "default": 0
    },
    {
      "name": "dragCoefficient",
      "offset_x86": 16,
      "offset_x86_64": 24,
      "ctype": "hkReal",
      "vtype": "TYPE_REAL",
      "vsubtype": "TYPE_VOID",
      "arrsize": 0,
      "flags": "FLAGS_NONE",
      "default": 0
    },
    {
      "name": "liftCoefficient",
      "offset_x86": 20,
      "offset_x86_64": 28,
      "ctype": "hkReal",
      "vtype": "TYPE_REAL",
      "vsubtype": "TYPE_VOID",
      "arrsize": 0,
      "flags": "FLAGS_NONE",
      "default": 0
    },
    {
      "name": "extraGravityws",
      "offset_x86": 32,
      "offset_x86_64": 32,
      "ctype": "hkVector4",
      "vtype": "TYPE_VECTOR4",
      "vsubtype": "TYPE_VOID",
      "arrsize": 0,
      "flags": "FLAGS_NONE",
      "default": 0
    }
  ]
}