{
  "name": "hkaWaveletCompressedAnimation",
  "version": 0,
  "signature": "0x77cf0962",
  "size_x86": 112,
  "size_x86_64": 136,
  "parent": "hkaAnimation",
  "vtable": true,
  "members": [
    {
      "name": "numberOfPoses",
      "offset_x86": 40,
      "offset_x86_64": 56,
      "ctype": "hkInt32",
      "vtype": "TYPE_INT32",
      "vsubtype": "TYPE_VOID",
      "arrsize": 0,
      "flags": "FLAGS_NONE",
      "default": 0
    },
    {
      "name": "blockSize",
      "offset_x86": 44,
      "offset_x86_64": 60,
      "ctype": "hkInt32",
      "vtype": "TYPE_INT32",
      "vsubtype": "TYPE_VOID",
      "arrsize": 0,
      "flags": "FLAGS_NONE",
      "default": 0
    },
    {
      "name": "qFormat",
      "offset_x86": 48,
      "offset_x86_64": 64,
      "class_ref": "hkaWaveletCompressedAnimationQuantizationFormat",
      "ctype": "struct hkaWaveletCompressedAnimationQuantizationFormat",
      "vtype": "TYPE_STRUCT",
      "vsubtype": "TYPE_VOID",
      "arrsize": 0,
      "flags": "FLAGS_NONE",
      "default": 0
    },
    {
      "name": "staticMaskIdx",
      "offset_x86": 68,
      "offset_x86_64": 84,
      "ctype": "hkUint32",
      "vtype": "TYPE_UINT32",
      "vsubtype": "TYPE_VOID",
      "arrsize": 0,
      "flags": "FLAGS_NONE",
      "default": 0
    },
    {
      "name": "staticDOFsIdx",
      "offset_x86": 72,
      "offset_x86_64": 88,
      "ctype": "hkUint32",
      "vtype": "TYPE_UINT32",
      "vsubtype": "TYPE_VOID",
      "arrsize": 0,
      "flags": "FLAGS_NONE",
      "default": 0
    },
    {
      "name": "numStaticTransformDOFs",
      "offset_x86": 76,
      "offset_x86_64": 92,
      "ctype": "hkUint32",
      "vtype": "TYPE_UINT32",
      "vsubtype": "TYPE_VOID",
      "arrsize": 0,
      "flags": "FLAGS_NONE",
      "default": 0
    },
    {
      "name": "numDynamicTransformDOFs",
      "offset_x86": 80,
      "offset_x86_64": 96,
      "ctype": "hkUint32",
      "vtype": "TYPE_UINT32",
      "vsubtype": "TYPE_VOID",
      "arrsize": 0,
      "flags": "FLAGS_NONE",
      "default": 0
    },
    {
      "name": "blockIndexIdx",
      "offset_x86": 84,
      "offset_x86_64": 100,
      "ctype": "hkUint32",
      "vtype": "TYPE_UINT32",
      "vsubtype": "TYPE_VOID",
      "arrsize": 0,
      "flags": "FLAGS_NONE",
      "default": 0
    },
    {
      "name": "blockIndexSize",
      "offset_x86": 88,
      "offset_x86_64": 104,
      "ctype": "hkUint32",
      "vtype": "TYPE_UINT32",
      "vsubtype": "TYPE_VOID",
      "arrsize": 0,
      "flags": "FLAGS_NONE",
      "default": 0
    },
    {
      "name": "quantizedDataIdx",
      "offset_x86": 92,
      "offset_x86_64": 108,
      "ctype": "hkUint32",
      "vtype": "TYPE_UINT32",
      "vsubtype": "TYPE_VOID",
      "arrsize": 0,
      "flags": "FLAGS_NONE",
      "default": 0
    },
    {
      "name": "quantizedDataSize",
      "offset_x86": 96,
      "offset_x86_64": 112,
      "ctype": "hkUint32",
      "vtype": "TYPE_UINT32",
      "vsubtype": "TYPE_VOID",
      "arrsize": 0,
      "flags": "FLAGS_NONE",
      "default": 0
    },
    {
      "name": "dataBuffer",
      "offset_x86": 100,
      "offset_x86_64": 120,
      "ctype": "hkArray<hkUint8>",
      "vtype": "TYPE_ARRAY",
      "vsubtype": "TYPE_UINT8",
      "arrsize": 0,
      "flags": "FLAGS_NONE",
      "default": 0
    }
  ]
}