{
  "name": "hkbFootIkControlsModifier",
  "version": 1,
  "signature": "0xe5b6f544",
  "size_x86": 144,
  "size_x86_64": 176,
  "parent": "hkbModifier",
  "vtable": true,
  "members": [
    {
      "name": "controlData",
      "offset_x86": 48,
      "offset_x86_64": 80,
      "class_ref": "hkbFootIkControlData",
      "ctype": "struct hkbFootIkControlData",
      "vtype": "TYPE_STRUCT",
      "vsubtype": "TYPE_VOID",
      "arrsize": 0,
      "flags": "FLAGS_NONE",
      "default": 0
    },
    {
      "name": "legs",
      "offset_x86": 96,
      "offset_x86_64": 128,
      "class_ref": "hkbFootIkControlsModifierLeg",
      "ctype": "hkArray<struct hkbFootIkControlsModifierLeg>",
      "vtype": "TYPE_ARRAY",
      "vsubtype": "TYPE_STRUCT",
      "arrsize": 0,
      "flags": "FLAGS_NONE",
      "default": 0
    },
    {
      "name": "errorOutTranslation",
      "offset_x86": 112,
      "offset_x86_64": 144,
      "ctype": "hkVector4",
      "vtype": "TYPE_VECTOR4",
      "vsubtype": "TYPE_VOID",
      "arrsize": 0,
      "flags": "FLAGS_NONE",
      "default": 0
    },
    {
      "name": "alignWithGroundRotation",
      "offset_x86": 128,
      "offset_x86_64": 160,
      "ctype": "hkQuaternion",
      "vtype": "TYPE_QUATERNION",
      "vsubtype": "TYPE_VOID",
      "arrsize": 0,
      "flags": "FLAGS_NONE",
      "default": 0
    }
  ]
}