{
  "name": "hkbSetWordVariableCommand",
  "version": 0,
  "signature": "0xf3ae5fca",
  "size_x86": 64,
  "size_x86_64": 64,
  "parent": "hkReferencedObject",
  "vtable": true,
  "members": [
    {
      "name": "quadValue",
      "offset_x86": 16,
      "offset_x86_64": 16,
      "ctype": "hkVector4",
      "vtype": "TYPE_VECTOR4",
      "vsubtype": "TYPE_VOID",
      "arrsize": 0,
      "flags": "FLAGS_NONE",
      "default": 0
    },
    {
      "name": "characterId",
      "offset_x86": 32,
      "offset_x86_64": 32,
      "ctype": "hkUint64",
      "vtype": "TYPE_UINT64",
      "vsubtype": "TYPE_VOID",
      "arrsize": 0,
      "flags": "FLAGS_NONE",
      "default": 0
    },
    {
      "name": "variableId",
      "offset_x86": 40,
      "offset_x86_64": 40,
      "ctype": "hkInt32",
      "vtype": "TYPE_INT32",
      "vsubtype": "TYPE_VOID",
      "arrsize": 0,
      "flags": "FLAGS_NONE",
      "default": 0
    },
    {
      "name": "value",
      "offset_x86": 44,
      "offset_x86_64": 44,
      "class_ref": "hkbVariableValue",
      "ctype": "struct hkbVariableValue",
      "vtype": "TYPE_STRUCT",
      "vsubtype": "TYPE_VOID",
      "arrsize": 0,
      "flags": "FLAGS_NONE",
      "default": 0
    },
    {
      "name": "type",
      "offset_x86": 48,
      "offset_x86_64": 48,
      "enum_ref": "VariableType",
      "ctype": "enum VariableType",
      "vtype": "TYPE_ENUM",
      "vsubtype": "TYPE_UINT8",
      "arrsize": 0,
      "flags": "FLAGS_NONE",
      "default": 0
    },
    {
      "name": "global",
      "offset_x86": 49,
      "offset_x86_64": 49,
      "ctype": "hkBool",
      "vtype": "TYPE_BOOL",
      "vsubtype": "TYPE_VOID",
      "arrsize": 0,
      "flags": "FLAGS_NONE",
      "default": 0
    }
  ]
}