{
  "name": "hkMonitorStreamColorTable",
  "version": 0,
  "signature": "0x79e53e85",
  "size_x86": 24,
  "size_x86_64": 40,
  "parent": "hkReferencedObject",
  "vtable": true,
  "members": [
    {
      "name": "colorPairs",
      "offset_x86": 8,
      "offset_x86_64": 16,
      "class_ref": "hkMonitorStreamColorTableColorPair",
      "ctype": "hkArray<struct hkMonitorStreamColorTableColorPair>",
      "vtype": "TYPE_ARRAY",
      "vsubtype": "TYPE_STRUCT",
      "arrsize": 0,
      "flags": "FLAGS_NONE",
      "default": 0
    },
    {
      "name": "defaultColor",
      "offset_x86": 20,
      "offset_x86_64": 32,
      "ctype": "hkUint32",
      "vtype": "TYPE_UINT32",
      "vsubtype": "TYPE_VOID",
      "arrsize": 0,
      "flags": "FLAGS_NONE",
      "default": 0
    }
  ]
}