{
  "name": "BSIStateManagerModifier",
  "version": 1,
  "signature": "0x6cb24f2e",
  "size_x86": 72,
  "size_x86_64": 128,
  "parent": "hkbModifier",
  "vtable": true,
  "members": [
    {
      "name": "iStateVar",
      "offset_x86": 44,
      "offset_x86_64": 80,
      "ctype": "hkInt32",
      "vtype": "TYPE_INT32",
      "vsubtype": "TYPE_VOID",
      "arrsize": 0,
      "flags": "FLAGS_NONE",
      "default": 0
    },
    {
      "name": "stateData",
      "offset_x86": 48,
      "offset_x86_64": 88,
      "class_ref": "BSIStateManagerModifierBSiStateData",
      "ctype": "hkArray<struct BSIStateManagerModifierBSiStateData>",
      "vtype": "TYPE_ARRAY",
      "vsubtype": "TYPE_STRUCT",
      "arrsize": 0,
      "flags": "FLAGS_NONE",
      "default": 0
    },
    {
      "name": "myStateListener",
      "offset_x86": 60,
      "offset_x86_64": 104,
      "class_ref": "BSIStateManagerModifierBSIStateManagerStateListener",
      "ctype": "struct BSIStateManagerModifierBSIStateManagerStateListener",
      "vtype": "TYPE_STRUCT",
      "vsubtype": "TYPE_VOID",
      "arrsize": 0,
      "flags": "FLAGS_NONE|SERIALIZE_IGNORED",
      "default": 0
    }
  ]
}