{
  "name": "hkpBallSocketConstraintAtom",
  "version": 3,
  "signature": "0xe70e4dfa",
  "size_x86": 16,
  "size_x86_64": 16,
  "parent": "hkpConstraintAtom",
  "vtable": false,
  "members": [
    {
      "name": "solvingMethod",
      "offset_x86": 2,
      "offset_x86_64": 2,
      "enum_ref": "SolvingMethod",
      "ctype": "enum SolvingMethod",
      "vtype": "TYPE_ENUM",
      "vsubtype": "TYPE_UINT8",
      "arrsize": 0,
      "flags": "FLAGS_NONE",
      "default": 1
    },
    {
      "name": "bodiesToNotify",
      "offset_x86": 3,
      "offset_x86_64": 3,
      "ctype": "hkUint8",
      "vtype": "TYPE_UINT8",
      "vsubtype": "TYPE_VOID",
      "arrsize": 0,
      "flags": "FLAGS_NONE",
      "default": 0
    },
    {
      "name": "velocityStabilizationFactor",
      "offset_x86": 4,
      "offset_x86_64": 4,
      "ctype": "hkUint8",
      "vtype": "TYPE_UINT8",
      "vsubtype": "TYPE_VOID",
      "arrsize": 0,
      "flags": "FLAGS_NONE",
      "default": 30
    },
    {
      "name": "maxImpulse",
      "offset_x86": 8,
      "offset_x86_64": 8,
      "ctype": "hkReal",
      "vtype": "TYPE_REAL",
      "vsubtype": "TYPE_VOID",
      "arrsize": 0,
      "flags": "FLAGS_NONE",
      "default": 0
    },
    {
      "name": "inertiaStabilizationFactor",
      "offset_x86": 12,
      "offset_x86_64": 12,
      "ctype": "hkReal",
      "vtype": "TYPE_REAL",
      "vsubtype": "TYPE_VOID",
      "arrsize": 0,
      "flags": "FLAGS_NONE",
      "default": 0
    }
  ]
}