{
  "name": "hkbTestStateChooser",
  "version": 0,
  "signature": "0xc0fcc436",
  "size_x86": 20,
  "size_x86_64": 32,
  "parent": "hkbStateChooser",
  "vtable": true,
  "members": [
    {
      "name": "int",
      "offset_x86": 8,
      "offset_x86_64": 16,
      "ctype": "hkInt32",
      "vtype": "TYPE_INT32",
      "vsubtype": "TYPE_VOID",
      "arrsize": 0,
      "flags": "FLAGS_NONE",
      "default": 0
    },
    {
      "name": "real",
      "offset_x86": 12,
      "offset_x86_64": 20,
      "ctype": "hkReal",
      "vtype": "TYPE_REAL",
      "vsubtype": "TYPE_VOID",
      "arrsize": 0,
      "flags": "FLAGS_NONE",
      "default": 0
    },
    {
      "name": "string",
      "offset_x86": 16,
      "offset_x86_64": 24,
      "ctype": "hkStringPtr",
      "vtype": "TYPE_STRINGPTR",
      "vsubtype": "TYPE_VOID",
      "arrsize": 0,
      "flags": "FLAGS_NONE",
      "default": 0
    }
  ]
}