{
  "name": "hkbStateMachineNestedStateMachineData",
  "version": 0,
  "signature": "0x7358f5da",
  "size_x86": 8,
  "size_x86_64": 16,
  "vtable": false,
  "members": [
    {
      "name": "nestedStateMachine",
      "offset_x86": 0,
      "offset_x86_64": 0,
      "ctype": "void*",
      "vtype": "TYPE_POINTER",
      "vsubtype": "TYPE_VOID",
      "arrsize": 0,
      "flags": "FLAGS_NONE|SERIALIZE_IGNORED",
      "default": 0
    },
    {
      "name": "eventIdMap",
      "offset_x86": 4,
      "offset_x86_64": 8,
      "ctype": "void*",
      "vtype": "TYPE_POINTER",
      "vsubtype": "TYPE_VOID",
      "arrsize": 0,
      "flags": "FLAGS_NONE|SERIALIZE_IGNORED",
      "default": 0
    }
  ]
}