{
  "name": "hkpCachingShapePhantom",
  "version": 0,
  "signature": "0xcf227f58",
  "size_x86": 368,
  "size_x86_64": 448,
  "parent": "hkpShapePhantom",
  "vtable": true,
  "members": [
    {
      "name": "collisionDetails",
      "offset_x86": 352,
      "offset_x86_64": 416,
      "ctype": "hkArray<void>",
      "vtype": "TYPE_ARRAY",
      "vsubtype": "TYPE_VOID",
      "arrsize": 0,
      "flags": "FLAGS_NONE|SERIALIZE_IGNORED",
      "default": 0
    },
    {
      "name": "orderDirty",
      "offset_x86": 364,
      "offset_x86_64": 432,
      "ctype": "hkBool",
      "vtype": "TYPE_BOOL",
      "vsubtype": "TYPE_VOID",
      "arrsize": 0,
      "flags": "FLAGS_NONE|SERIALIZE_IGNORED",
      "default": 0
    }
  ]
}