{
  "name": "BSIStateManagerModifierBSIStateManagerStateListener",
  "version": 0,
  "signature": "0x99463586",
  "size_x86": 12,
  "size_x86_64": 24,
  "parent": "hkbStateListener",
  "vtable": true,
  "members": [
    {
      "name": "pStateManager",
      "offset_x86": 8,
      "offset_x86_64": 16,
      "ctype": "void*",
      "vtype": "TYPE_POINTER",
      "vsubtype": "TYPE_VOID",
      "arrsize": 0,
      "flags": "FLAGS_NONE|SERIALIZE_IGNORED",
      "default": 0
    }
  ]
}