{
  "name": "hkbFootIkControlsModifierLeg",
  "version": 0,
  "signature": "0x9e17091a",
  "size_x86": 32,
  "size_x86_64": 48,
  "vtable": false,
  "members": [
    {
      "name": "groundPosition",
      "offset_x86": 0,
      "offset_x86_64": 0,
      "ctype": "hkVector4",
      "vtype": "TYPE_VECTOR4",
      "vsubtype": "TYPE_VOID",
      "arrsize": 0,
      "flags": "FLAGS_NONE",
      "default": 0
    },
    {
      "name": "ungroundedEvent",
      "offset_x86": 16,
      "offset_x86_64": 16,
      "class_ref": "hkbEventProperty",
      "ctype": "struct hkbEventProperty",
      "vtype": "TYPE_STRUCT",
      "vsubtype": "TYPE_VOID",
      "arrsize": 0,
      "flags": "FLAGS_NONE",
      "default": 0
    },
    {
      "name": "verticalError",
      "offset_x86": 24,
      "offset_x86_64": 32,
      "ctype": "hkReal",
      "vtype": "TYPE_REAL",
      "vsubtype": "TYPE_VOID",
      "arrsize": 0,
      "flags": "FLAGS_NONE",
      "default": 0
    },
    {
      "name": "hitSomething",
      "offset_x86": 28,
      "offset_x86_64": 36,
      "ctype": "hkBool",
      "vtype": "TYPE_BOOL",
      "vsubtype": "TYPE_VOID",
      "arrsize": 0,
      "flags": "FLAGS_NONE",
      "default": 0
    },
    {
      "name": "isPlantedMS",
      "offset_x86": 29,
      "offset_x86_64": 37,
      "ctype": "hkBool",
      "vtype": "TYPE_BOOL",
      "vsubtype": "TYPE_VOID",
      "arrsize": 0,
      "flags": "FLAGS_NONE",
      "default": 0
    }
  ]
}